{
  "run_id": "9de36138125744ca930a2c39791e49ba",
  "created_at": "2026-02-25T03:55:09.141451+00:00",
  "updated_at": "2026-02-25T03:55:09.141451+00:00",
  "requirements": null,
  "architecture": {
    "artifact_ref": "architecture:v1"
  },
  "backend_code": {
    "artifact_ref": "backend_code:v1"
  },
  "frontend_code": {
    "artifact_ref": "frontend_code:v1"
  },
  "qa_report": null,
  "deployment": null,
  "iteration": 0,
  "total_tokens": 1810,
  "total_api_calls": 3,
  "artifact_store": {
    "architecture": [
      {
        "artifact_id": "architecture-doc",
        "artifact_type": "architecture",
        "producer": "architect",
        "content": {
          "tech_stack": {
            "backend": {
              "language": "Java 17",
              "framework": "Spring Boot 3.x"
            },
            "frontend": {
              "framework": "React 18"
            },
            "database": {
              "primary": "PostgreSQL 15"
            },
            "infrastructure": {
              "container": "Docker"
            }
          },
          "modules": [
            {
              "name": "auth-module",
              "responsibility": "User registration, login, and JWT handling",
              "dependencies": []
            }
          ],
          "database_schema": {
            "tables": [
              {
                "name": "users",
                "columns": [
                  "id",
                  "username",
                  "password_hash"
                ]
              }
            ]
          },
          "openapi_spec": {
            "paths": {
              "/auth/register": {
                "post": {
                  "summary": "Register user"
                }
              },
              "/auth/login": {
                "post": {
                  "summary": "Login user"
                }
              }
            }
          },
          "deployment": {
            "containers": [
              "backend",
              "frontend",
              "postgres"
            ],
            "networking": {
              "mode": "bridge"
            }
          }
        },
        "version": 1,
        "created_at": "2026-02-25T03:55:09.141451+00:00",
        "metadata": {}
      }
    ],
    "backend_code": [
      {
        "artifact_id": "backend-auth-module",
        "artifact_type": "backend_code",
        "producer": "backend_dev",
        "content": {
          "module": "auth",
          "changed_files": [
            "src/main/java/com/example/auth/AuthController.java",
            "src/main/java/com/example/auth/AuthService.java"
          ],
          "code_bundle": {
            "src/main/java/com/example/auth/AuthController.java": "package com.example.auth;\npublic class AuthController {\n    // Minimal placeholder controller for week3 smoke\n}\n",
            "src/main/java/com/example/auth/AuthService.java": "package com.example.auth;\npublic class AuthService {\n    // Minimal placeholder service for week3 smoke\n}\n"
          },
          "build_notes": {
            "compile_status": "simulated_pass"
          },
          "test_notes": {
            "unit_tests": "simulated_pending"
          }
        },
        "version": 1,
        "created_at": "2026-02-25T03:55:09.141451+00:00",
        "metadata": {}
      }
    ],
    "frontend_code": [
      {
        "artifact_id": "frontend-auth-module",
        "artifact_type": "frontend_code",
        "producer": "frontend_dev",
        "content": {
          "module": "auth",
          "changed_files": [
            "src/pages/LoginPage.jsx",
            "src/services/authApi.js"
          ],
          "code_bundle": {
            "src/pages/LoginPage.jsx": "export function LoginPage() {\n  return <div>Login Page Placeholder</div>;\n}\n",
            "src/services/authApi.js": "export async function login(payload) {\n  return { token: 'mock-token', user: payload.username };\n}\n"
          },
          "build_notes": {
            "build_status": "simulated_pass"
          },
          "ui_state_notes": {
            "loading_error_empty": "covered_in_placeholder"
          }
        },
        "version": 1,
        "created_at": "2026-02-25T03:55:09.141451+00:00",
        "metadata": {}
      }
    ]
  },
  "message_log": [
    {
      "sender": "orchestrator",
      "receiver": "architect",
      "content": "Layer-level scope: align architecture layer with backend and frontend auth implementation layers.",
      "msg_type": "TASK",
      "artifacts": [],
      "timestamp": "2026-02-25T03:55:09.141451+00:00",
      "metadata": {}
    },
    {
      "sender": "architect",
      "receiver": "backend_dev",
      "content": "Architecture ready for backend implementation.",
      "msg_type": "TASK",
      "artifacts": [
        "architecture-doc:v1"
      ],
      "timestamp": "2026-02-25T03:55:09.141451+00:00",
      "metadata": {}
    },
    {
      "sender": "backend_dev",
      "receiver": "frontend_dev",
      "content": "Backend auth module ready for frontend integration.",
      "msg_type": "TASK",
      "artifacts": [
        "backend-auth-module:v1"
      ],
      "timestamp": "2026-02-25T03:55:09.141451+00:00",
      "metadata": {}
    },
    {
      "sender": "frontend_dev",
      "receiver": "qa",
      "content": "Frontend auth module ready for QA validation.",
      "msg_type": "TASK",
      "artifacts": [
        "frontend-auth-module:v1"
      ],
      "timestamp": "2026-02-25T03:55:09.141451+00:00",
      "metadata": {}
    }
  ]
}