{
  "run_id": "087872c16c4f4d5cac951e847a00e846",
  "created_at": "2026-02-24T09:23:53.838624+00:00",
  "updated_at": "2026-02-24T09:23:53.838624+00:00",
  "requirements": {
    "artifact_ref": "requirements:v2"
  },
  "architecture": null,
  "backend_code": null,
  "frontend_code": null,
  "qa_report": null,
  "deployment": null,
  "iteration": 1,
  "total_tokens": 256,
  "total_api_calls": 1,
  "artifact_store": {
    "requirements": [
      {
        "artifact_id": "requirements-doc",
        "artifact_type": "requirements",
        "producer": "pm",
        "content": {
          "project_name": "StayBooking",
          "functional_requirements": [
            {
              "id": "FR-001",
              "user_story": "As a guest, I want to login so I can book stays",
              "acceptance_criteria": [
                "Given valid creds, when login, then JWT returned"
              ],
              "priority": "Must",
              "complexity": "Low"
            }
          ],
          "non_functional_requirements": [
            {
              "id": "NFR-001",
              "description": "JWT auth"
            }
          ],
          "api_contracts": [
            {
              "endpoint": "/auth/login",
              "method": "POST"
            }
          ],
          "data_model": {
            "entities": [
              "User"
            ],
            "relationships": []
          }
        },
        "version": 1,
        "created_at": "2026-02-24T09:23:53.838624+00:00",
        "metadata": {}
      },
      {
        "artifact_id": "requirements-doc",
        "artifact_type": "requirements",
        "producer": "pm",
        "content": {
          "project_name": "StayBooking",
          "functional_requirements": [
            {
              "id": "FR-001",
              "user_story": "As a guest, I want to login so I can book stays",
              "acceptance_criteria": [
                "Given valid creds, when login, then JWT returned"
              ],
              "priority": "Must",
              "complexity": "Low"
            }
          ],
          "non_functional_requirements": [
            {
              "id": "NFR-001",
              "description": "JWT auth"
            }
          ],
          "api_contracts": [
            {
              "endpoint": "/auth/login",
              "method": "POST"
            }
          ],
          "data_model": {
            "entities": [
              "User"
            ],
            "relationships": []
          },
          "revision_note": "Added non-functional clarification."
        },
        "version": 2,
        "created_at": "2026-02-24T09:23:53.838624+00:00",
        "metadata": {}
      }
    ]
  },
  "message_log": [
    {
      "sender": "orchestrator",
      "receiver": "pm",
      "content": "Generate requirements for StayBooking auth module.",
      "msg_type": "TASK",
      "artifacts": [],
      "timestamp": "2026-02-24T09:23:53.838624+00:00",
      "metadata": {}
    },
    {
      "sender": "pm",
      "receiver": "architect",
      "content": "Requirements ready for architecture design.",
      "msg_type": "APPROVAL",
      "artifacts": [
        "requirements-doc:v2"
      ],
      "timestamp": "2026-02-24T09:23:53.838624+00:00",
      "metadata": {}
    }
  ]
}