{
  "run_id": "f4bb4ecc76a5476f8adce1ffbd73d569",
  "created_at": "2026-02-24T10:42:22.728858+00:00",
  "updated_at": "2026-02-24T10:42:22.728858+00:00",
  "requirements": {
    "artifact_ref": "requirements:v1"
  },
  "architecture": {
    "artifact_ref": "architecture:v1"
  },
  "backend_code": null,
  "frontend_code": null,
  "qa_report": null,
  "deployment": null,
  "iteration": 0,
  "total_tokens": 730,
  "total_api_calls": 2,
  "artifact_store": {
    "requirements": [
      {
        "artifact_id": "requirements-doc",
        "artifact_type": "requirements",
        "producer": "pm",
        "content": {
          "project_name": "StayBooking",
          "functional_requirements": [
            {
              "id": "FR-001",
              "user_story": "As a guest, I want to login so I can book stays",
              "acceptance_criteria": [
                "Given valid creds, when login, then JWT returned"
              ],
              "priority": "Must",
              "complexity": "Low"
            }
          ],
          "non_functional_requirements": [
            {
              "id": "NFR-001",
              "description": "JWT auth"
            }
          ],
          "api_contracts": [
            {
              "endpoint": "/auth/login",
              "method": "POST"
            }
          ],
          "data_model": {
            "entities": [
              "User"
            ],
            "relationships": []
          }
        },
        "version": 1,
        "created_at": "2026-02-24T10:42:22.728858+00:00",
        "metadata": {}
      }
    ],
    "architecture": [
      {
        "artifact_id": "architecture-doc",
        "artifact_type": "architecture",
        "producer": "architect",
        "content": {
          "tech_stack": {
            "backend": {
              "language": "Java 17",
              "framework": "Spring Boot 3.x"
            },
            "frontend": {
              "framework": "React 18"
            }
          },
          "modules": [
            {
              "name": "auth-module",
              "responsibility": "Login and registration"
            }
          ],
          "database_schema": {
            "tables": [
              "users"
            ]
          },
          "openapi_spec": {
            "paths": {
              "/auth/login": {
                "post": {}
              }
            }
          },
          "deployment": {
            "target": "docker-compose"
          }
        },
        "version": 1,
        "created_at": "2026-02-24T10:42:22.728858+00:00",
        "metadata": {}
      }
    ]
  },
  "message_log": [
    {
      "sender": "orchestrator",
      "receiver": "pm",
      "content": "Start sequential workflow on auth module.",
      "msg_type": "TASK",
      "artifacts": [],
      "timestamp": "2026-02-24T10:42:22.728858+00:00",
      "metadata": {}
    },
    {
      "sender": "pm",
      "receiver": "architect",
      "content": "Requirements ready.",
      "msg_type": "TASK",
      "artifacts": [
        "requirements-doc:v1"
      ],
      "timestamp": "2026-02-24T10:42:22.728858+00:00",
      "metadata": {}
    },
    {
      "sender": "architect",
      "receiver": "orchestrator",
      "content": "Architecture draft completed.",
      "msg_type": "STATUS",
      "artifacts": [
        "architecture-doc:v1"
      ],
      "timestamp": "2026-02-24T10:42:22.728858+00:00",
      "metadata": {}
    }
  ]
}